{
    "name": "Schoko Muffin",
    "portions": "12 Muffins",
    "tags": [
        "vegi",
        "chocolate",
        "sweet",
        "vegan",
        "oven"
    ],
    "ingredients": {
        "mehl": {
            "amount": "250g"
        },
        "zucker": {
            "amount": "170g"
        },
        "backpulver": {
            "amount": "10g"
        },
        "kakao": {
            "amount": "30g"
        },
        "oel": {
            "amount": "100g"
        },
        "milch-soja": {
            "amount": "250g"
        }
    },
    "preparation": [
        "{mehl}, {zucker}, {kakao}, {backpulver} mit {oel} und {milch-soja} mixen.",
        "Den Teig auf 12 Muffinformen verteilen und 25 Minuten bei 180Â°C backen."
    ]
}