{
    "name": "Chili con potato",
    "portions": "4 Portionen",
    "tags": [
        "main",
        "mexican",
        "pot",
        "vegi"
    ],
    "ingredients": {
        "kartoffel": {
            "amount": "500g"
        },
        "zwiebel": {
            "amount": "2"
        },
        "knoblauchzehe": {},
        "tomaten-passiert": {
            "amount": "1 Pkg."
        },
        "bier": {
            "amount": "350ml"
        },
        "chili": {},
        "kidneybohnen": {
            "amount": "1 Dose"
        },
        "mais": {
            "amount": "1 Dose"
        },
        "tomatenmark": {
            "amount": "2 EL"
        },
        "gewuerze": {
            "name": "Salz, Pfeffer, Kümmel, Paprikapulver, Thymian, Zucker und Kakaopulver"
        },
        "baguette": {
            "amount": "1"
        },
        "creme-fraiche": {}
    },
    "preparation": [
        "{zwiebel}, {knoblauchzehe} und {kartoffel} würfeln.",
        "{zwiebel} und {knoblauchzehe} anschwitzen. {kartoffel}, {tomatenmark} hinzufügen und mit anschwitzen.",
        "{bier}, {tomaten-passiert}, {chili}, {mais} und {gewuerze} hinzufügen.",
        "{kidneybohnen} hinzufügen und einkochen.",
        "Mit {baguette} und {creme-fraiche} servieren."
    ]
}