{
    "name": "Kiwi Joghurt Drink",
    "tags": [
        "drink",
        "longdrink",
        "blender"
    ],
    "ingredients": {
        "joghurt": {
            "amount": "200g"
        },
        "zucker": {
            "amount": "1 EL"
        },
        "kiwi": {
            "amount": "1"
        },
        "vanilleeis": {
            "amount": "1 Kugel"
        }
    },
    "preparation": [
        "{joghurt}, {zucker} und {kiwi} pürieren/mixen. Mit {vanilleeis} ins Glas geben."
    ],
    "garnish": "Kiwischeiben/-stückchen"
}