{
    "name": "Spaghetti Carbonara",
    "tags": [
        "pasta",
        "main",
        "pot",
        "pan"
    ],
    "ingredients": {
        "pasta": {},
        "ei": {
            "amount": "2"
        },
        "parmesan": {},
        "pancetta": {
            "name": "Pancetta (Schinken)"
        },
        "pfeffer": {}
    },
    "preparation": [
        "{pasta} kochen. {pancetta} in der Pfanne anbraten.",
        "{ei} mit {parmesan} und {pfeffer} verrühren.",
        "{pasta} zu {pancetta} geben. Von der Hitze nehmen und Ei-Gemisch hinzufügen und verrühren bis die Konsistenz passt."
    ]
}