{
    "name": "Kartoffel&shy;suppe",
    "portions": "4 Portionen",
    "tags": [
        "soup",
        "vegi",
        "side",
        "main",
        "pot",
        "dach"
    ],
    "ingredients": {
        "karotte": {
            "amount": "1"
        },
        "kartoffel": {
            "amount": "300g"
        },
        "sellerie": {
            "amount": "150g"
        },
        "paprika": {
            "amount": "1/2"
        },
        "lauchzwiebel": {
            "amount": "1 Bund"
        },
        "wasser": {
            "amount": "500ml"
        },
        "butter": {},
        "zwiebel": {
            "amount": "1/2"
        },
        "bruehe": {},
        "creme-fraiche": {
            "amount": "75g"
        },
        "gewuerze": {
            "name": "Pfeffer und Muskatnuss"
        }
    },
    "preparation": [
        "{kartoffel:100g}, {sellerie} schälen und wie {paprika} und {karotte} würfeln. Die grüne Seite der {lauchzwiebel} in Ringe schneiden.",
        "In {wasser} mit Salz garen. Das Gemüse abgießen und dabei das Kochwasser auffangen. Die Zwiebel und den weißen Teil der Lauchzwiebel fein schneiden.",
        "In dem Topf {butter} schmelzen und die {zwiebel} glasig dünsten. Die restlichen {kartoffel:200g} schälen und in Stücke schneiden. Zusammen mit dem aufgefangenen Kochwasser und der {bruehe} in den Topf geben. Bei geschlossenem Deckel die Kartoffeln gar kochen.",
        "{creme-fraiche}, {gewuerze} hinzugeben und pürieren."
    ],
    "garnish": "gegarten Gemüsewürfeln und Kräutern"
}