{
    "name": "Whisky Soße",
    "tags": [
        "sauce",
        "pot"
    ],
    "ingredients": {
        "butter": {},
        "zwiebel": {
            "amount": "1"
        },
        "knoblauchzehe": {
            "amount": "1"
        },
        "ketchup": {
            "amount": "5 EL"
        },
        "sirup-zucker": {
            "amount": "5 EL",
            "link": "sirup-zucker"
        },
        "whisky": {
            "amount": "4 EL"
        },
        "essig-balsamico": {
            "amount": "1 EL"
        }
    },
    "preparation": [
        "{butter} in einem Topf bei mittlerer Hitze zerlassen.",
        "{zwiebel} unter rühren goldbraun braten. {knoblauchzehe} hinzufügen und mitbraten.",
        "{ketchup}, {sirup-zucker}, {whisky}, {essig-balsamico} hinzufügen. 10 - 15min köcheln lassen."
    ]
}