{
    "name": "Pina Colada",
    "tags": [
        "drink",
        "alcohol",
        "hurricane",
        "blender"
    ],
    "ingredients": {
        "rum-weiss": {
            "amount": "5cl"
        },
        "ananassaft": {
            "amount": "5cl"
        },
        "kokosmilch": {
            "amount": "5cl"
        },
        "ananas": {
            "amount": "1 Scheibe"
        }
    },
    "preparation": [
        "{ananassaft}, {rum-weiss}, {kokosmilch} und {ananas} mit 3 bis 4 Eisw√ºrfeln mixen.",
        "Ins Glas geben."
    ],
    "garnish": "Ananasscheibe"
}