{
    "name": "Brioche Brötchen",
    "portions": "6 Buns",
    "tags": [
        "side",
        "oven",
        "vegi",
        "ingredient",
        "burger"
    ],
    "ingredients": {
        "tangzhong": {
            "link": "/tangzhong"
        },
        "milch": {
            "amount": "120g"
        },
        "hefe": {
            "amount": "9g"
        },
        "mehl": {
            "amount": "420g"
        },
        "salz": {
            "amount": "7g"
        },
        "zucker": {
            "amount": "35g"
        },
        "ei": {
            "amount": "3"
        },
        "butter": {
            "amount": "40g"
        }
    },
    "preparation": [
        "{milch} erwärmen und mit {hefe} 10 Minuten auflösen lassen.",
        "{tangzhong}, {mehl}, {salz}, {zucker}, {butter} mit {milch} und {ei:2} zusammengeben und zu einem Teig kneten. 1.5h in einer eingefetteten Schüssel gehen lassen.",
        "In 100g schwere Bällchen teilen. Den Teig auseinander ziehen und oben zusammenfalten. Dann umdrehen und die Öffnung schließen. Die Bällchen eine Stunde gehen lassen.",
        "{ei:1} mit einem Schuss {milch} vermischen und damit die Bällchen bestreichen. Bei 180°C für 15min goldbraun backen."
    ]
}