{
    "name": "Erdbeer&shy;limes",
    "portions": "4 Liter",
    "tags": [
        "drink",
        "alcohol",
        "fruity",
        "pot",
        "blender"
    ],
    "ingredients": {
        "erdbeeren": {
            "amount": "1kg"
        },
        "limettensaft": {
            "amount": "350ml"
        },
        "zucker": {
            "amount": "200g"
        },
        "wodka": {
            "amount": "500ml"
        },
        "wasser": {
            "amount": "200ml"
        }
    },
    "preparation": [
        "{wasser} mit {zucker} kurz aufkochen. {erdbeeren} mixen und zusammen mit {limettensaft} und {wodka} zum Zuckerwasser geben."
    ]
}