{
    "name": "Schweinefilet auf Rosenkohl",
    "tags": [
        "meat",
        "main",
        "oven",
        "pan",
        "dach"
    ],
    "ingredients": {
        "rosenkohl": {
            "amount": "1"
        },
        "kartoffel": {
            "amount": "500g"
        },
        "knoblauchzehe": {
            "amount": "2"
        },
        "rosmarin": {},
        "kuemmel": {},
        "salz": {},
        "oel": {},
        "schweinefilet": {
            "amount": "500g"
        },
        "pfeffer": {},
        "quark-kraeuter": {}
    },
    "preparation": [
        "{kartoffel} in Spalten schneiden. {knoblauchzehe} zerdr체cken. {knoblauchzehe}, {kartoffel}, {rosenkohl}, {rosmarin}, {kuemmel}, {salz}, {pfeffer} mit {oel} mischen.",
        "Im Ofen bei 180째C f체r ca. 30 Minuten backen.",
        "{schweinefilet} trocken tupfen und in {oel} scharf anbraten. Mit in den Ofen geben und 10 Minuten mitgaren. 5 Minuten abk체hlen lassen.",
        "Mit {quark-kraeuter} servieren."
    ],
    "garnish": "Erdbeere"
}